[
  {
    "id": 1,
    "nome": "Smartphone",
    "marca": "Apple",
    "preco": 299.99,
    "stock": 25,
    "caracteristicas": {
      "tela": "6.5 polegadas",
      "bateria": "4000mAh",
      "armazenamento": "128GB"
    }
  },
  {
    "id": 2,
    "nome": "Auriculares Bluetooth",
    "marca": "Samsung",
    "preco": 59.9,
    "stock": 50,
    "caracteristicas": {
      "tela": "n/a",
      "bateria": "500mAh",
      "armazenamento": "n/a"
    }
  },
  {
    "id": 3,
    "nome": "Coluna Bluetooth",
    "marca": "JBL",
    "preco": 79.99,
    "stock": 30,
    "caracteristicas": {
      "tela": "n/a",
      "bateria": "2000mAh",
      "armazenamento": "n/a"
    }
  }
]